{
  "schemaVersion": "1.0.0",
  "rulesId": "rules.srdi.v1.0.0",
  "level": "SRDI",
  "levelName": "专精特新中小企业",
  "region": "JS",
  "policyBasis": [
    {
      "doc": "优质中小企业梯度培育管理办法",
      "no": "工信部企业〔2026〕2号",
      "effectiveFrom": "2026-04-01",
      "url": "https://www.miit.gov.cn"
    },
    {
      "doc": "中小企业专精特新发展评价指标体系(企业)(试行)",
      "no": "工信厅企业〔2024〕75号",
      "effectiveFrom": "2026-04-01"
    }
  ],
  "effectiveFrom": "2026-04-01",
  "effectiveTo": null,
  "status": "active",
  "supersedes": null,
  "passLine": 50,
  "benchmarksRef": {
    "file": "industry-benchmarks.v1.2.0.json",
    "version": "1.2.0"
  },
  "policies": {
    "weightModel": "dimensionShare",
    "missingPolicy": "rangeBounds",
    "rounding": {
      "decimals": 2,
      "mode": "half_up"
    },
    "cClassFallback": {
      "score": 0.5,
      "confidence": "estimated"
    }
  },
  "gates": [
    {
      "id": "GATE_1",
      "name": "主体资格与细分市场年限",
      "type": "expr",
      "logic": "all",
      "unknownPolicy": "notPass",
      "checks": [
        {
          "id": "G1a",
          "label": "已获得科技和创新型中小企业称号",
          "expr": "company.scitechSmeTitle == true"
        },
        {
          "id": "G1b",
          "label": "截至上年末从事特定细分市场满 3 年",
          "expr": "company.subMarketYears >= 3"
        }
      ]
    },
    {
      "id": "GATE_2",
      "name": "营收规模、业务聚焦与负债水平",
      "type": "expr",
      "logic": "all",
      "unknownPolicy": "notPass",
      "checks": [
        {
          "id": "G2a",
          "label": "上年度营业收入 ≥1500 万,或近两年新增股权投资 ≥2000 万",
          "expr": "fin.revenue[y0] >= 15000000 || fin.equityInvested >= 20000000"
        },
        {
          "id": "G2b",
          "label": "主营业务收入占营业收入比重 ≥80%",
          "expr": "fin.mainBusinessRevenue[y0] / fin.revenue[y0] >= 0.80"
        },
        {
          "id": "G2c",
          "label": "上年末资产负债率 ≤80%",
          "expr": "fin.assetLiabilityRatio[y0] <= 0.80"
        }
      ]
    },
    {
      "id": "GATE_3",
      "name": "研发费用投入强度",
      "type": "expr",
      "logic": "all",
      "unknownPolicy": "notPass",
      "checks": [
        {
          "id": "G3a",
          "label": "上年研发费用 ≥100 万元",
          "expr": "fin.rdExpense[y1] >= 1000000"
        },
        {
          "id": "G3b",
          "label": "前年研发费用 ≥100 万元",
          "expr": "fin.rdExpense[y2] >= 1000000"
        },
        {
          "id": "G3c",
          "label": "上年研发费用占营业收入 ≥3%",
          "expr": "fin.rdExpense[y1] / fin.revenue[y1] >= 0.03"
        },
        {
          "id": "G3d",
          "label": "前年研发费用占营业收入 ≥3%",
          "expr": "fin.rdExpense[y2] / fin.revenue[y2] >= 0.03"
        }
      ]
    },
    {
      "id": "GATE_4",
      "name": "Ⅰ类知识产权或豁免条件",
      "type": "expr",
      "logic": "anyOf",
      "unknownPolicy": "pending",
      "checks": [
        {
          "id": "G4a",
          "label": "拥有 ≥1 项自主申请、权利人排名前三的Ⅰ类知识产权",
          "expr": "count(ip.inventionI where selfApplied == true && applicantRank <= 3 && transferredIn == false) >= 1"
        },
        {
          "id": "G4b",
          "label": "近三年获省部级以上科技奖励且排名前三(豁免)",
          "expr": "qual.scienceAward == true",
          "exemption": true
        },
        {
          "id": "G4c",
          "label": "拥有经认定的省部级以上研发机构(豁免)",
          "expr": "qual.rdInstitution == 'national' || qual.rdInstitution == 'province'",
          "exemption": true
        }
      ]
    },
    {
      "id": "GATE_5",
      "name": "主导产品市场地位",
      "type": "expr",
      "logic": "anyOf",
      "unknownPolicy": "pending",
      "checks": [
        {
          "id": "G5a",
          "label": "主导产品在细分市场占有率较为靠前",
          "expr": "qual.marketRanking == 'national_top3' || qual.marketRanking == 'province_top3' || qual.marketRanking == 'province_top5'"
        },
        {
          "id": "G5b",
          "label": "提供细分市场占有率说明且进入省级前列",
          "expr": "qual.marketRanking == 'province_top10'"
        }
      ]
    },
    {
      "id": "GATE_6",
      "name": "专精特新发展评价得分",
      "type": "scoreGate",
      "passLine": 50,
      "totalKey": "conservative",
      "unknownPolicy": "notPass"
    }
  ],
  "dimensions": [
    {
      "id": "DIM_PROFESSION",
      "name": "专业化",
      "weight": 15,
      "indicators": [
        {
          "id": "IND_01",
          "code": 1,
          "name": "从事细分市场年限",
          "share": 1,
          "dataClass": "A",
          "unit": "year",
          "aggregation": { "method": "last" },
          "formula": { "expr": "company.subMarketYears", "inputs": ["company.subMarketYears"] },
          "scoring": {
            "type": "piecewise",
            "points": [[0, 0], [2, 0.2], [4, 0.4], [6, 0.6], [8, 0.8], [10, 1]],
            "clamp": [0, 1],
            "tail": "hold"
          },
          "evidenceRefs": ["company.subMarketYears"],
          "explain": { "template": "从事细分市场 {raw} 年" }
        },
        {
          "id": "IND_02",
          "code": 2,
          "name": "细分行业营业收入排名",
          "share": 1,
          "dataClass": "C",
          "unit": "enum",
          "scoring": {
            "type": "manualTier",
            "maxPoints": 10,
            "options": [
              { "key": "national_top3", "points": 10, "label": "全国前三" },
              { "key": "province_top3", "points": 10, "label": "省内前三" },
              { "key": "province_top5", "points": 7, "label": "省内前五" },
              { "key": "province_top10", "points": 4, "label": "省内前十" },
              { "key": "none", "points": 1, "label": "未进入前列" }
            ]
          },
          "evidenceRefs": ["qual.marketRanking"],
          "fallback": {
            "type": "neutral",
            "score": 0.5,
            "confidence": "estimated",
            "reason": "细分行业排名依赖全行业企业库,第三方无法取得"
          }
        },
        {
          "id": "IND_03",
          "code": 3,
          "name": "发明专利集中度",
          "share": 1,
          "dataClass": "A",
          "unit": "ratio",
          "aggregation": { "method": "last" },
          "formula": {
            "expr": "sum((ipc_i / total)^2)",
            "inputs": ["ip.ipcDistribution", "ip.inventionFirstApplicant"],
            "guard": "ip.inventionFirstApplicant > 0"
          },
          "scoring": {
            "type": "hhi",
            "distributionRef": "ip.ipcDistribution",
            "totalRef": "ip.inventionFirstApplicant",
            "points": [[0, 0], [0.15, 0.4], [0.35, 0.75], [0.6, 1]]
          },
          "evidenceRefs": ["ip.ipcDistribution", "ip.inventionFirstApplicant"],
          "explain": { "template": "发明专利按 IPC 大类分布的赫芬达尔指数 {raw}" }
        },
        {
          "id": "IND_04",
          "code": 4,
          "name": "主持或参与制修订标准数量",
          "share": 1,
          "dataClass": "A",
          "unit": "point",
          "scoring": {
            "type": "formulaSum",
            "terms": [
              { "ref": "std.hostedIntl#count", "coef": 5 },
              { "ref": "std.hostedNatInd#count", "coef": 3 },
              { "ref": "std.joinedIntl#count", "coef": 2 },
              { "ref": "std.joinedNatInd#count", "coef": 1 }
            ],
            "cap": 10
          },
          "evidenceRefs": ["std.hostedIntl", "std.hostedNatInd", "std.joinedIntl", "std.joinedNatInd"],
          "explain": { "template": "标准计分 {raw} 分(国际主持×5 + 国家/行业主持×3 + 国际参与×2 + 国家/行业参与×1)" }
        }
      ]
    },
    {
      "id": "DIM_REFINE",
      "name": "精细化",
      "weight": 20,
      "indicators": [
        {
          "id": "IND_05",
          "code": 5,
          "name": "人均营业收入超行业均值",
          "share": 1,
          "dataClass": "B",
          "unit": "CNY/person",
          "aggregation": { "window": ["y0", "y1", "y2"], "method": "mean" },
          "formula": {
            "expr": "mean(fin.revenue) / mean(company.employeeYearAvg)",
            "inputs": ["fin.revenue", "company.employeeYearAvg"],
            "guard": "company.employeeYearAvg > 0"
          },
          "scoring": {
            "type": "benchmark",
            "direction": "positive",
            "benchmarkKey": "revenuePerEmployee",
            "curve": { "base": 0.6, "kUp": 0.5, "kDown": 1.0 }
          },
          "evidenceRefs": ["fin.revenue", "company.employeeYearAvg"],
          "explain": { "template": "人均营业收入 {raw} 元/人,行业均值 {benchmark} 元/人" }
        },
        {
          "id": "IND_06",
          "code": 6,
          "name": "净资产收益率超行业均值",
          "share": 1,
          "dataClass": "B",
          "unit": "percent",
          "aggregation": { "window": ["y0", "y1", "y2"], "method": "mean" },
          "formula": {
            "expr": "mean(fin.netProfit) / mean(fin.netAssets)",
            "inputs": ["fin.netProfit", "fin.netAssets"],
            "guard": "fin.netAssets > 0"
          },
          "scoring": {
            "type": "benchmark",
            "direction": "positive",
            "benchmarkKey": "roe",
            "curve": { "base": 0.6, "kUp": 0.5, "kDown": 1.0 }
          },
          "evidenceRefs": ["fin.netProfit", "fin.netAssets"],
          "explain": { "template": "净资产收益率 {raw},行业均值 {benchmark}" }
        },
        {
          "id": "IND_07",
          "code": 7,
          "name": "成本利润率超行业均值",
          "share": 1,
          "dataClass": "B",
          "unit": "percent",
          "aggregation": { "window": ["y0", "y1", "y2"], "method": "mean" },
          "formula": {
            "expr": "mean(fin.totalProfit) / mean(fin.productSalesCost)",
            "inputs": ["fin.totalProfit", "fin.productSalesCost"],
            "guard": "fin.productSalesCost > 0"
          },
          "scoring": {
            "type": "benchmark",
            "direction": "positive",
            "benchmarkKey": "costProfitMargin",
            "curve": { "base": 0.6, "kUp": 0.5, "kDown": 1.0 }
          },
          "evidenceRefs": ["fin.totalProfit", "fin.productSalesCost"],
          "explain": { "template": "成本利润率 {raw},行业均值 {benchmark}" }
        },
        {
          "id": "IND_08",